{
    "manifest_name": "m",
    "plugin_definition": "P",
    "stores": [
        {
            "name": "FFRD",
            "store_type": "S3",
            "profile": "FFRD",
            "params": {
                "root": "/model-library"
            }
        }
    ],
    "outputs": [
        {
            "name": "o",
            "paths": {
                "default": "x.json"
            },
            "store_name": "FFRD"
        }
    ],
    "actions": []
}
